Authors,Year,Link,Affiliations,Authors with affiliations
"Maluf J.W.",1988,"https://www.scopus.com/inward/record.uri?eid=2-s2.0-4243859107&doi=10.1088%2f0264-9381%2f5%2f5%2f002&partnerID=40&md5=351cb8ba2d1f65c75db7a911a4e8ff54","Dept. of Fisica, Brasilia Univ., Brazil","Maluf, J.W., Dept. of Fisica, Brasilia Univ., Brazil"
"Nunes O.A.C.",1988,"https://www.scopus.com/inward/record.uri?eid=2-s2.0-36549104965&doi=10.1063%2f1.340026&partnerID=40&md5=1f71fe7063dd70ac1af33bc2bdf4f64c","Physics Department, University of Brasília, Solid State Physics Laboratory, 70910-Brasília-DF, Brazil","Nunes, O.A.C., Physics Department, University of Brasília, Solid State Physics Laboratory, 70910-Brasília-DF, Brazil"
"Maluf J.W.",1988,"https://www.scopus.com/inward/record.uri?eid=2-s2.0-23044504491&doi=10.1088%2f0264-9381%2f5%2f2%2f017&partnerID=40&md5=6da9874ee2f025c43cee284822921853","Dept. de Fisica, Brasilia Univ., Brazil","Maluf, J.W., Dept. de Fisica, Brasilia Univ., Brazil"
"Letelier P.S., Oliveira S.R.",1988,"https://www.scopus.com/inward/record.uri?eid=2-s2.0-0347164006&doi=10.1088%2f0264-9381%2f5%2f2%2f002&partnerID=40&md5=7982564a04f660cdf3085699275a3feb","Dept. de Fisica, Brasilia Univ., Brazil","Letelier, P.S., Dept. de Fisica, Brasilia Univ., Brazil; Oliveira, S.R., Dept. de Fisica, Brasilia Univ., Brazil"
"Dorea J.G., Paine P.A.",1988,"https://www.scopus.com/inward/record.uri?eid=2-s2.0-0024247454&partnerID=40&md5=16b286e1385d42adb6545a5fd77fbb9a","Nutrition Laboratory, Faculty of Health Sciences, Universidade de Brasilia, Brasilia, Brazil","Dorea, J.G., Nutrition Laboratory, Faculty of Health Sciences, Universidade de Brasilia, Brasilia, Brazil; Paine, P.A., Nutrition Laboratory, Faculty of Health Sciences, Universidade de Brasilia, Brasilia, Brazil"
"East G.A., Rath S.",1988,"https://www.scopus.com/inward/record.uri?eid=2-s2.0-0024226890&doi=10.1080%2f00032718808059909&partnerID=40&md5=fad5bae5df9ec4ec44d8290c7a9fbdb0","Departamento de Química, Universidade de Brasília, 70.910 Brasília D.F., Brazil","East, G.A., Departamento de Química, Universidade de Brasília, 70.910 Brasília D.F., Brazil; Rath, S., Departamento de Química, Universidade de Brasília, 70.910 Brasília D.F., Brazil"
"Bermudez L.A., Guillon P., Obregon J., Bert A.",1988,"https://www.scopus.com/inward/record.uri?eid=2-s2.0-0024138725&partnerID=40&md5=83304c89ccf356f669f0e86d22fa0d02","Univ de Brasilia, Braz","Bermudez, L.A., Univ de Brasilia, Braz; Guillon, P., Univ de Brasilia, Braz; Obregon, J., Univ de Brasilia, Braz; Bert, A., Univ de Brasilia, Braz"
"Barroso de Assis Fonseca Sergio, Soares Antonio Jose Martins, Giarola Attilio Jose",1988,"https://www.scopus.com/inward/record.uri?eid=2-s2.0-0024137436&partnerID=40&md5=e9cc250bd754e6e85adfcb752020890e","Univ of Brasilia, Braz","Barroso de Assis Fonseca, Sergio, Univ of Brasilia, Braz; Soares, Antonio Jose Martins, Univ of Brasilia, Braz; Giarola, Attilio Jose, Univ of Brasilia, Braz"
"Malvar Henrique S.",1988,"https://www.scopus.com/inward/record.uri?eid=2-s2.0-0024124018&partnerID=40&md5=c39fc1860ba10bd3465270cbfc56572f","Univ of Brasilia, Braz","Malvar, Henrique S., Univ of Brasilia, Braz"
"Costa D.G., Oliveira A.S.",1988,"https://www.scopus.com/inward/record.uri?eid=2-s2.0-51249171410&doi=10.1007%2fBF02584819&partnerID=40&md5=58b8673199cec4b71ca206033952bb1e","Departamento de Matemática, Universidade de Brasîlia, Brasîlia, 70.910, DF, Brazil; Departamento de Matemática-CCEN, Universidade Federal da Paraîba, João Pessoa, 58.059, PB, Brazil","Costa, D.G., Departamento de Matemática, Universidade de Brasîlia, Brasîlia, 70.910, DF, Brazil, Departamento de Matemática-CCEN, Universidade Federal da Paraîba, João Pessoa, 58.059, PB, Brazil; Oliveira, A.S., Departamento de Matemática, Universidade de Brasîlia, Brasîlia, 70.910, DF, Brazil, Departamento de Matemática-CCEN, Universidade Federal da Paraîba, João Pessoa, 58.059, PB, Brazil"
"De Figueiredo D.G., Gossez J.-P.",1988,"https://www.scopus.com/inward/record.uri?eid=2-s2.0-0000069825&doi=10.1007%2fBF01456841&partnerID=40&md5=bd6aaeed0d87584943cb820127f5a3b5","Departamento de Matematica, Universidade de Brasilia, Brasilia, 70910, D.F., Brazil; Département de Mathématique, C.P.214, Université Libre de Bruxelles, Bd. du Triomphe, Campus Plaine, Bruxelles, B-1050, Belgium","De Figueiredo, D.G., Departamento de Matematica, Universidade de Brasilia, Brasilia, 70910, D.F., Brazil; Gossez, J.-P., Département de Mathématique, C.P.214, Université Libre de Bruxelles, Bd. du Triomphe, Campus Plaine, Bruxelles, B-1050, Belgium"
"Fournelle T., Sidki S., Weston K.",1988,"https://www.scopus.com/inward/record.uri?eid=2-s2.0-34250088712&doi=10.1007%2fBF01198626&partnerID=40&md5=0f4a7bcc746c7693fb8c2f081cccae8d","Mathematics Department, University of Wisconsin-Parkside, Kenosha, 53141, Wisconsin, United States; Departamento de Matemática, Universidade de Brasília, Brasília DF, 70910, Brazil","Fournelle, T., Mathematics Department, University of Wisconsin-Parkside, Kenosha, 53141, Wisconsin, United States; Sidki, S., Departamento de Matemática, Universidade de Brasília, Brasília DF, 70910, Brazil; Weston, K., Mathematics Department, University of Wisconsin-Parkside, Kenosha, 53141, Wisconsin, United States"
"Campiglia A.D., de Lima C.G.",1988,"https://www.scopus.com/inward/record.uri?eid=2-s2.0-33845278809&doi=10.1021%2fac00170a039&partnerID=40&md5=f6d32555286063269cba27ea6402e482","Departamento de Química, Universidade de Brasilia, Brasilia, DF 70910, Brazil; Department of Chemistry University of Florida, Gainesville, FL 32611, United States","Campiglia, A.D., Departamento de Química, Universidade de Brasilia, Brasilia, DF 70910, Brazil, Department of Chemistry University of Florida, Gainesville, FL 32611, United States; de Lima, C.G., Departamento de Química, Universidade de Brasilia, Brasilia, DF 70910, Brazil"
"Neto J.J.S., Vianna J.D.M.",1988,"https://www.scopus.com/inward/record.uri?eid=2-s2.0-36149029628&doi=10.1088%2f0305-4470%2f21%2f11%2f010&partnerID=40&md5=3f50a190fb2f8d132a0bd7814654cd6e","Departamento de Física, Instituto de Ciências Exatas, Universidade de Brasília, Brasília DF, 70910, Brazil","Neto, J.J.S., Departamento de Física, Instituto de Ciências Exatas, Universidade de Brasília, Brasília DF, 70910, Brazil; Vianna, J.D.M., Departamento de Física, Instituto de Ciências Exatas, Universidade de Brasília, Brasília DF, 70910, Brazil"
"Paine P., Wright M.D.G.",1988,"https://www.scopus.com/inward/record.uri?eid=2-s2.0-84970462669&doi=10.1177%2f016327878801100307&partnerID=40&md5=ee240bcdda05545b889406fc0be2c5fa","Faculty of Health Services, University of Brasilia, Brazil","Paine, P., Faculty of Health Services, University of Brasilia, Brazil; Wright, M.D.G., Faculty of Health Services, University of Brasilia, Brazil"
"Gonçalves J.V.A.",1988,"https://www.scopus.com/inward/record.uri?eid=2-s2.0-45549120290&doi=10.1016%2f0362-546X%2888%2990078-8&partnerID=40&md5=f030a892c356fe20a8ba1cbc9646733f","Departamento de Matemática-IE, Universidade de Brasília, 70910 Brasília, DF, Brazil","Gonçalves, J.V.A., Departamento de Matemática-IE, Universidade de Brasília, 70910 Brasília, DF, Brazil"
"Holvorcem P.R.C., Osório R.",1988,"https://www.scopus.com/inward/record.uri?eid=2-s2.0-45549119380&doi=10.1016%2f0378-4371%2888%2990198-7&partnerID=40&md5=64a5e3a6c280fd1f7cedf6ad204cb551","Departamento de Física, Universidade de Brasília, 70910 Brasília, DF, Brazil","Holvorcem, P.R.C., Departamento de Física, Universidade de Brasília, 70910 Brasília, DF, Brazil; Osório, R., Departamento de Física, Universidade de Brasília, 70910 Brasília, DF, Brazil"
"Dardenne M.A., Ferreira Filho C.F., Meirelles M.R.",1988,"https://www.scopus.com/inward/record.uri?eid=2-s2.0-38249032534&doi=10.1016%2f0895-9811%2888%2990023-5&partnerID=40&md5=b9d0dc736c873aba8d92767ef7a0fd8c","Departamento de Geociências, University of Brasília, Brasília, DF 70.910, Brazil","Dardenne, M.A., Departamento de Geociências, University of Brasília, Brasília, DF 70.910, Brazil; Ferreira Filho, C.F., Departamento de Geociências, University of Brasília, Brasília, DF 70.910, Brazil; Meirelles, M.R., Departamento de Geociências, University of Brasília, Brasília, DF 70.910, Brazil"
"Bucher R.E., Totugui M.L.",1988,"https://www.scopus.com/inward/record.uri?eid=2-s2.0-18244422933&partnerID=40&md5=1f61799d2e60ccecb4a2a123a113adb4","Depto. de Psicologia, Universidade de Brasilia, Brasil., Brazil","Bucher, R.E., Depto. de Psicologia, Universidade de Brasilia, Brasil., Brazil; Totugui, M.L., Depto. de Psicologia, Universidade de Brasilia, Brasil., Brazil"
"Henriques F.G., Trinta D.A.",1988,"https://www.scopus.com/inward/record.uri?eid=2-s2.0-18244413939&partnerID=40&md5=fb7dda31074104320d7db48cf3feac85","Departamento de Medicina Especializada, Faculdade de Ciências da Saúde, Universidade de Brasilia, Brasil, Brazil","Henriques, F.G., Departamento de Medicina Especializada, Faculdade de Ciências da Saúde, Universidade de Brasilia, Brasil, Brazil; Trinta, D.A., Departamento de Medicina Especializada, Faculdade de Ciências da Saúde, Universidade de Brasilia, Brasil, Brazil"
"Fonseca A.L.A., Nunes O.A.C., Araga F.R.F.",1988,"https://www.scopus.com/inward/record.uri?eid=2-s2.0-1542589303&doi=10.1103%2fPhysRevA.38.4732&partnerID=40&md5=812bb5e7167b869bf790e4a4551d8b95","Physics Department, University of Brasília, Brasília, 70 910, DF, Brazil","Fonseca, A.L.A., Physics Department, University of Brasília, Brasília, 70 910, DF, Brazil; Nunes, O.A.C., Physics Department, University of Brasília, Brasília, 70 910, DF, Brazil; Araga, F.R.F., Physics Department, University of Brasília, Brasília, 70 910, DF, Brazil"
"De Figueiredo D.G.",1988,"https://www.scopus.com/inward/record.uri?eid=2-s2.0-12144264517&doi=10.1216%2fRMJ-1988-18-2-287&partnerID=40&md5=009dfc6c2a73861a85aad4625de13da7","Departamento De Matemática, Universidade De Brasilia, Brasili, 70910, Brazil","De Figueiredo, D.G., Departamento De Matemática, Universidade De Brasilia, Brasili, 70910, Brazil"
"Bucher R.",1988,"https://www.scopus.com/inward/record.uri?eid=2-s2.0-0024267539&partnerID=40&md5=598d77ea1a9dca9ebff10f05e5654c18","Institut de Psychologie, Universite de Brasilia, Brasilia, Brazil","Bucher, R., Institut de Psychologie, Universite de Brasilia, Brasilia, Brazil"
"Ventura M.M.",1988,"https://www.scopus.com/inward/record.uri?eid=2-s2.0-0024262202&partnerID=40&md5=454d65f4db34a523fa92d9f1b7ab5138","Departamento de Biologia Celular, Universidade de Brasília, DF., Brazil","Ventura, M.M., Departamento de Biologia Celular, Universidade de Brasília, DF., Brazil"
"Ventura M.M.",1988,"https://www.scopus.com/inward/record.uri?eid=2-s2.0-0024261392&partnerID=40&md5=16c7715523e2486da3ff9ac713615e35","Departamento de Biologia Celular, Universidade de Brasília, DF., Brazil","Ventura, M.M., Departamento de Biologia Celular, Universidade de Brasília, DF., Brazil"
"Ventura M.M.",1988,"https://www.scopus.com/inward/record.uri?eid=2-s2.0-0024249338&partnerID=40&md5=84108ddead054aa3c2892ce7a7b2f667","Departamento de Biologia Celular, Universidade de Brasília, DF., Brazil","Ventura, M.M., Departamento de Biologia Celular, Universidade de Brasília, DF., Brazil"
"Haridasan M., De Araújo G.M.",1988,"https://www.scopus.com/inward/record.uri?eid=2-s2.0-0024220882&doi=10.1016%2f0378-1127%2888%2990021-7&partnerID=40&md5=fef213f336a21f1a35ea386c2597011d","Laboratório de Ecologia, Departamento de Biologia Vegetal, Universidade de Brasilia, Caixa Postal 153081, Brasilia, DF 70919, Brazil","Haridasan, M., Laboratório de Ecologia, Departamento de Biologia Vegetal, Universidade de Brasilia, Caixa Postal 153081, Brasilia, DF 70919, Brazil; De Araújo, G.M., Laboratório de Ecologia, Departamento de Biologia Vegetal, Universidade de Brasilia, Caixa Postal 153081, Brasilia, DF 70919, Brazil"
"Hessel M.H.R.",1988,"https://www.scopus.com/inward/record.uri?eid=2-s2.0-0024197958&partnerID=40&md5=906f05b7d7ccfb9fcb70fbb10d3bedc5","Dept de Geociencias, Univ de Brasilia, CP 152775, 70919 Brasilia, DF, Brazil, Brazil","Hessel, M.H.R., Dept de Geociencias, Univ de Brasilia, CP 152775, 70919 Brasilia, DF, Brazil, Brazil"
"Hay J.D., Barreto E.J.M.",1988,"https://www.scopus.com/inward/record.uri?eid=2-s2.0-0024180071&doi=10.2307%2f2388316&partnerID=40&md5=b1e72cf7e82a4b5a29362bb0eccc1354","Dept. de Biologia Vegetal, Cx. Postal 153.081, Universidade de Brasilia, Brasilia, DF, 70.919, Brazil., Brazil","Hay, J.D., Dept. de Biologia Vegetal, Cx. Postal 153.081, Universidade de Brasilia, Brasilia, DF, 70.919, Brazil., Brazil; Barreto, E.J.M., Dept. de Biologia Vegetal, Cx. Postal 153.081, Universidade de Brasilia, Brasilia, DF, 70.919, Brazil., Brazil"
"Rizzo L.V., Cunha-Neto E., Teixeira A.R.",1988,"https://www.scopus.com/inward/record.uri?eid=2-s2.0-0024116249&doi=10.1590%2fS0074-02761988000500023&partnerID=40&md5=6e869a95f0385a89a119451b57f775d3","Immunopathology Laboratory, Universidade de Brasília.","Rizzo, L.V., Immunopathology Laboratory, Universidade de Brasília.; Cunha-Neto, E., Immunopathology Laboratory, Universidade de Brasília.; Teixeira, A.R., Immunopathology Laboratory, Universidade de Brasília."
"Nazareno H.N., Alencar P.S.C.",1988,"https://www.scopus.com/inward/record.uri?eid=2-s2.0-0024090027&doi=10.1016%2f0921-4526%2888%2990034-8&partnerID=40&md5=d1dad4a11432e7bc651f90af644fb329","Departamento de Física Universidade de Brasília, 70910 Brasília, Brazil","Nazareno, H.N., Departamento de Física Universidade de Brasília, 70910 Brasília, Brazil; Alencar, P.S.C., Departamento de Física Universidade de Brasília, 70910 Brasília, Brazil"
"Almeida M.A., Politi J.R., Ubatuba F.B.",1988,"https://www.scopus.com/inward/record.uri?eid=2-s2.0-0024074116&partnerID=40&md5=f57c188325a6b826df0adf6a9795d207","Farmacologia Médica, Departamento de Medicina Especializada, Universidade de Brasília., Brazil","Almeida, M.A., Farmacologia Médica, Departamento de Medicina Especializada, Universidade de Brasília., Brazil; Politi, J.R., Farmacologia Médica, Departamento de Medicina Especializada, Universidade de Brasília., Brazil; Ubatuba, F.B., Farmacologia Médica, Departamento de Medicina Especializada, Universidade de Brasília., Brazil"
"Paine P., Pereira M.G.",1988,"https://www.scopus.com/inward/record.uri?eid=2-s2.0-0023976360&partnerID=40&md5=d1f50ef29dda6681db404b31087818ca","Department of Community Medicine, University of Brasilia, Brazil","Paine, P., Department of Community Medicine, University of Brasilia, Brazil; Pereira, M.G., Department of Community Medicine, University of Brasilia, Brazil"
"Aucélio J.G.",1988,"https://www.scopus.com/inward/record.uri?eid=2-s2.0-0023946669&doi=10.1016%2f0306-3623%2888%2990052-3&partnerID=40&md5=0ec616ca5e14a2109b149367bd185c0f","Laboratory of Pharmacology, University of Brasília, Brasília, DF 70910, Brazil","Aucélio, J.G., Laboratory of Pharmacology, University of Brasília, Brasília, DF 70910, Brazil"
"Rosa A.C., Cuba C.C., Vexenat A., Barreto A.C., Marsden P.D.",1988,"https://www.scopus.com/inward/record.uri?eid=2-s2.0-0023942739&doi=10.1016%2f0035-9203%2888%2990138-1&partnerID=40&md5=399158dd284765f6a42da40954acbc51","Leishmaniasis Laboratory, Núcleo de Medicina Tropical e Nutrição, Universidade de Brasília, Brasília, Brazil","Rosa, A.C., Leishmaniasis Laboratory, Núcleo de Medicina Tropical e Nutrição, Universidade de Brasília, Brasília, Brazil; Cuba, C.C., Leishmaniasis Laboratory, Núcleo de Medicina Tropical e Nutrição, Universidade de Brasília, Brasília, Brazil; Vexenat, A., Leishmaniasis Laboratory, Núcleo de Medicina Tropical e Nutrição, Universidade de Brasília, Brasília, Brazil; Barreto, A.C., Leishmaniasis Laboratory, Núcleo de Medicina Tropical e Nutrição, Universidade de Brasília, Brasília, Brazil; Marsden, P.D., Leishmaniasis Laboratory, Núcleo de Medicina Tropical e Nutrição, Universidade de Brasília, Brasília, Brazil"
"Peterson N.E., Costa M.A.F., Vexenat J.A., Netto E.M., Marsden P.D., Magalhaes A.V., Barretto A.C.",1988,"https://www.scopus.com/inward/record.uri?eid=2-s2.0-0023894160&doi=10.2307%2f3282071&partnerID=40&md5=562817155ba101cb8393219bd8c1e23e","Nucleo de Medicina Tropical e Nutricao, Universidade de Brasilia, 70.910 Brasilia, Brazil","Peterson, N.E., Nucleo de Medicina Tropical e Nutricao, Universidade de Brasilia, 70.910 Brasilia, Brazil; Costa, M.A.F., Nucleo de Medicina Tropical e Nutricao, Universidade de Brasilia, 70.910 Brasilia, Brazil; Vexenat, J.A., Nucleo de Medicina Tropical e Nutricao, Universidade de Brasilia, 70.910 Brasilia, Brazil; Netto, E.M., Nucleo de Medicina Tropical e Nutricao, Universidade de Brasilia, 70.910 Brasilia, Brazil; Marsden, P.D., Nucleo de Medicina Tropical e Nutricao, Universidade de Brasilia, 70.910 Brasilia, Brazil; Magalhaes, A.V., Nucleo de Medicina Tropical e Nutricao, Universidade de Brasilia, 70.910 Brasilia, Brazil; Barretto, A.C., Nucleo de Medicina Tropical e Nutricao, Universidade de Brasilia, 70.910 Brasilia, Brazil"
"Dorea J.G., De Araujo M.O.G.",1988,"https://www.scopus.com/inward/record.uri?eid=2-s2.0-0023878434&partnerID=40&md5=8bed9f3e0c74623ff318a77890d639b0","Department of Nutrition, University of Brasilia, C.P. 15-2772, 70.919-Brasilia, DF, Brazil","Dorea, J.G., Department of Nutrition, University of Brasilia, C.P. 15-2772, 70.919-Brasilia, DF, Brazil; De Araujo, M.O.G., Department of Nutrition, University of Brasilia, C.P. 15-2772, 70.919-Brasilia, DF, Brazil"
"Friedman H., Friedman I.V.C., Mello C.V.",1988,"https://www.scopus.com/inward/record.uri?eid=2-s2.0-0023807106&partnerID=40&md5=83bb94e3632b346db7e447fd1262ed46","Laboratorio de Patologia, Faculdade de Ciencias da Saude, Universidade de Brasilia, Brasilia-DF-CEP 70910, Brazil","Friedman, H., Laboratorio de Patologia, Faculdade de Ciencias da Saude, Universidade de Brasilia, Brasilia-DF-CEP 70910, Brazil; Friedman, I.V.C., Laboratorio de Patologia, Faculdade de Ciencias da Saude, Universidade de Brasilia, Brasilia-DF-CEP 70910, Brazil; Mello, C.V., Laboratorio de Patologia, Faculdade de Ciencias da Saude, Universidade de Brasilia, Brasilia-DF-CEP 70910, Brazil"
"Garcia-Zapata M.T., Marsden P.D., Das Virgens D., De Araujo Soares V.",1988,"https://www.scopus.com/inward/record.uri?eid=2-s2.0-0023722604&partnerID=40&md5=f4e49deba84d8301856d62fb998dd685","Nucleo de Medicina Tropical e Nutricao, Universidade de Brasilia, Brasilia, Brazil","Garcia-Zapata, M.T., Nucleo de Medicina Tropical e Nutricao, Universidade de Brasilia, Brasilia, Brazil; Marsden, P.D., Nucleo de Medicina Tropical e Nutricao, Universidade de Brasilia, Brasilia, Brazil; Das Virgens, D., Nucleo de Medicina Tropical e Nutricao, Universidade de Brasilia, Brasilia, Brazil; De Araujo Soares, V., Nucleo de Medicina Tropical e Nutricao, Universidade de Brasilia, Brasilia, Brazil"
"Dorea J.G., Cabral M.S., Da Gloria M., Wright M., Rodrigues K.H.",1988,"https://www.scopus.com/inward/record.uri?eid=2-s2.0-0023710553&partnerID=40&md5=c092030d4f206eb6decf8233a256b63f","Department of Nutrition, Universidade de Brasilia, 70919 Bradilia, DF, Brazil","Dorea, J.G., Department of Nutrition, Universidade de Brasilia, 70919 Bradilia, DF, Brazil; Cabral, M.S., Department of Nutrition, Universidade de Brasilia, 70919 Bradilia, DF, Brazil; Da Gloria, M., Department of Nutrition, Universidade de Brasilia, 70919 Bradilia, DF, Brazil; Wright, M., Department of Nutrition, Universidade de Brasilia, 70919 Bradilia, DF, Brazil; Rodrigues, K.H., Department of Nutrition, Universidade de Brasilia, 70919 Bradilia, DF, Brazil"
"Malvar Henrique S., Staelin David H.",1988,"https://www.scopus.com/inward/record.uri?eid=2-s2.0-0023704010&partnerID=40&md5=8aa40e03d2daf3f10211a002c093a0bc","Univ of Brasilia, Braz, Univ of Brasilia, Braz","Malvar, Henrique S., Univ of Brasilia, Braz, Univ of Brasilia, Braz; Staelin, David H., Univ of Brasilia, Braz, Univ of Brasilia, Braz"
"Vilar de Araujo A.O., China Bezerra A.J., Junior L.P.",1988,"https://www.scopus.com/inward/record.uri?eid=2-s2.0-0023676137&partnerID=40&md5=eeab7e56983491ea3d5623b5d66ae060","Faculdade de Ciencias da Saude, Universidade de Brasilia, Campus Universitario, 70910 Asa Norte, Brazil","Vilar de Araujo, A.O., Faculdade de Ciencias da Saude, Universidade de Brasilia, Campus Universitario, 70910 Asa Norte, Brazil; China Bezerra, A.J., Faculdade de Ciencias da Saude, Universidade de Brasilia, Campus Universitario, 70910 Asa Norte, Brazil; Junior, L.P., Faculdade de Ciencias da Saude, Universidade de Brasilia, Campus Universitario, 70910 Asa Norte, Brazil"
"Araújo G.M., Haridasan M.",1988,"https://www.scopus.com/inward/record.uri?eid=2-s2.0-0008382477&doi=10.1080%2f00103628809367996&partnerID=40&md5=766b678c49b1c26c90d7ff06c737ae23","Laboratorio de Ecologia, Departamento de Biologia Vegetal, Universidade de Brasilia, CP 153081, 70919 Brasilia DF, Brazil","Araújo, G.M., Laboratorio de Ecologia, Departamento de Biologia Vegetal, Universidade de Brasilia, CP 153081, 70919 Brasilia DF, Brazil; Haridasan, M., Laboratorio de Ecologia, Departamento de Biologia Vegetal, Universidade de Brasilia, CP 153081, 70919 Brasilia DF, Brazil"
"Silveira V.",1988,"https://www.scopus.com/inward/record.uri?eid=2-s2.0-0004337113&doi=10.1103%2fPhysRevD.38.3823&partnerID=40&md5=cb77c76606ae391e5adff256bfb086f9","Departamento de Física, Universidade de Brasília, 70910 Brasília, Dist. Fed., Brazil","Silveira, V., Departamento de Física, Universidade de Brasília, 70910 Brasília, Dist. Fed., Brazil"
"Fonseca A.L.A., Nunes O.A.C.",1988,"https://www.scopus.com/inward/record.uri?eid=2-s2.0-0004277144&doi=10.1103%2fPhysRevA.37.400&partnerID=40&md5=46a4a660685b52d4c542ac19fbd6103e","Physics Department, University of Brasília, 70910-Brasília, DF, Brazil","Fonseca, A.L.A., Physics Department, University of Brasília, 70910-Brasília, DF, Brazil; Nunes, O.A.C., Physics Department, University of Brasília, 70910-Brasília, DF, Brazil"
"Haridasan M.",1988,"https://www.scopus.com/inward/record.uri?eid=2-s2.0-0001389524&doi=10.1080%2f00103628809367997&partnerID=40&md5=e794349dfb3fa685bee26e96083ea382","Laboratorio de Ecologia, Departamento de Biologia Vegetal, Universidade de Brasilia, CP 153081, 70919 Brasilia DF, Brazil","Haridasan, M., Laboratorio de Ecologia, Departamento de Biologia Vegetal, Universidade de Brasilia, CP 153081, 70919 Brasilia DF, Brazil"
"Letelier P.S., Verdaguer E.",1988,"https://www.scopus.com/inward/record.uri?eid=2-s2.0-0040446384&doi=10.1103%2fPhysRevD.37.2333&partnerID=40&md5=eb227ba2c6138a5f2cb02bafe294a7eb","Departamento de Física, Universidade de Brasília, 70910 Brasília, DF, Brazil; Departament de Física Teòrica, Universitat Autònoma de Barcelona, Bellaterra, Spain","Letelier, P.S., Departamento de Física, Universidade de Brasília, 70910 Brasília, DF, Brazil; Verdaguer, E., Departament de Física Teòrica, Universitat Autònoma de Barcelona, Bellaterra, Spain"
"Assumpção M., Suárez G.",1988,"https://www.scopus.com/inward/record.uri?eid=2-s2.0-0024219837&doi=10.1111%2fj.1365-246X.1988.tb01138.x&partnerID=40&md5=35b35bb9818022e7bb6b307f7a40f700","Depto. de Geociências, Universidade de Brasilia, Brasilia, 70910, Brazil; Lamont-Doherty Geological Observatory, Palisades, New York, 10967, United States","Assumpção, M., Depto. de Geociências, Universidade de Brasilia, Brasilia, 70910, Brazil; Suárez, G., Lamont-Doherty Geological Observatory, Palisades, New York, 10967, United States"
"Baumann R., Braga H.C.",1988,"https://www.scopus.com/inward/record.uri?eid=2-s2.0-0024191061&doi=10.1016%2f0305-750X%2888%2990015-0&partnerID=40&md5=15b0337fcfdbb0648bf69f101ce1d565","University of Brasilia, Brazil; Federal University of Rio de Janeiro, Brazil","Baumann, R., University of Brasilia, Brazil; Braga, H.C., Federal University of Rio de Janeiro, Brazil"
"Wright C.L., Turkienicz B.",1988,"https://www.scopus.com/inward/record.uri?eid=2-s2.0-0024156133&doi=10.1016%2f0264-2751%2888%2990025-X&partnerID=40&md5=9f7612c46bd9ca19e96fc792b1ab055c","University of Brasília, Brazil; Faculty of Architecture, Federal University of Rio Grande do Sul, Brazil","Wright, C.L., University of Brasília, Brazil; Turkienicz, B., Faculty of Architecture, Federal University of Rio Grande do Sul, Brazil"
"Beals R., Tenenblat K.",1988,"https://www.scopus.com/inward/record.uri?eid=2-s2.0-0010761661&doi=10.1002%2fsapm1988783227&partnerID=40&md5=b75cfb34abf27776375887edf69a1853","Yale University, United States; Universidade de Brasilia, Brazil","Beals, R., Yale University, United States; Tenenblat, K., Universidade de Brasilia, Brazil"
"Morais P.C., Ribeiro G.M., Chaves A.S.",1988,"https://www.scopus.com/inward/record.uri?eid=2-s2.0-0005246834&doi=10.1143%2fJPSJ.57.2812&partnerID=40&md5=40a44f29569522bce4eee313f99eff9c","Laboratório de Estado Sólido, Departamento de Física Universidade de Brasilia, 70910-Brasília, Brazil; Departamento de Física, Universidade Federal de Minas Gerais 31, 270-Belo Horizonte, Brazil","Morais, P.C., Laboratório de Estado Sólido, Departamento de Física Universidade de Brasilia, 70910-Brasília, Brazil; Ribeiro, G.M., Departamento de Física, Universidade Federal de Minas Gerais 31, 270-Belo Horizonte, Brazil; Chaves, A.S., Departamento de Física, Universidade Federal de Minas Gerais 31, 270-Belo Horizonte, Brazil"
